{"schemaVersion":1,"surface":"web","target":"examples/language-of-parts/mismatch.html","title":"Travel notes (corrupted)","locale":"en","viewport":{"width":1280,"height":800,"scale":1},"root":{"ref":"html","role":"document","lang":"en","states":[],"bounds":{"x":0,"y":0,"width":1280,"height":287.9},"native":{"tag":"html","attributes":{"lang":"en"},"html":"<html lang=\"en\">","langText":"Travel notes Our guide greeted us at the station with a short speech: Later, a sign at the market read:"},"children":[{"ref":"html > body","role":"generic","states":[],"bounds":{"x":8,"y":21.4,"width":1264,"height":258.4},"native":{"tag":"body","attributes":{}},"children":[{"ref":"html > body > main","role":"main","states":[],"bounds":{"x":8,"y":21.4,"width":1264,"height":258.4},"native":{"tag":"main","attributes":{}},"children":[{"ref":"html > body > main > h1","role":"heading","name":"Travel notes","text":"Travel notes","states":[],"bounds":{"x":8,"y":21.4,"width":1264,"height":37},"native":{"tag":"h1","attributes":{}},"children":[]},{"ref":"html > body > main > p:nth-of-type(1)","role":"paragraph","text":"Our guide greeted us at the station with a short speech:","states":[],"bounds":{"x":8,"y":79.9,"width":1264,"height":18},"native":{"tag":"p","attributes":{}},"children":[]},{"ref":"html > body > main > blockquote","role":"blockquote","lang":"es","states":[],"bounds":{"x":48,"y":113.9,"width":1184,"height":18},"native":{"tag":"blockquote","attributes":{"lang":"es"},"html":"<blockquote lang=\"es\">\n        <p>Welkom in Amsterdam! Het weer is vandaag mooi en zonnig, dus we gaan eerst naar het museum en daarna naar de grachten.</p>\n      </blockquote>","langText":"Welkom in Amsterdam! Het weer is vandaag mooi en zonnig, dus we gaan eerst naar het museum en daarna naar de grachten."},"children":[{"ref":"html > body > main > blockquote > p","role":"paragraph","text":"Welkom in Amsterdam! Het weer is vandaag mooi en zonnig, dus we gaan eerst naar het museum en daarna naar de grachten.","states":[],"bounds":{"x":48,"y":113.9,"width":1184,"height":18},"native":{"tag":"p","attributes":{}},"children":[]}]},{"ref":"html > body > main > p:nth-of-type(2)","role":"paragraph","text":"Later, a sign at the market read:","states":[],"bounds":{"x":8,"y":147.9,"width":1264,"height":18},"native":{"tag":"p","attributes":{}},"children":[]},{"ref":"html > body > main > p:nth-of-type(3)","role":"paragraph","text":"Bem-vindo à feira! Aproveite as frutas da estação e volte sempre.","lang":"pt-BR","states":[],"bounds":{"x":8,"y":181.9,"width":1264,"height":18},"native":{"tag":"p","attributes":{"lang":"pt-BR"},"html":"<p lang=\"pt-BR\">Bem-vindo à feira! Aproveite as frutas da estação e volte sempre.</p>","langText":"Bem-vindo à feira! Aproveite as frutas da estação e volte sempre."},"children":[]},{"ref":"html > body > main > img","role":"img","states":[],"bounds":{"x":8,"y":215.9,"width":120,"height":60},"native":{"tag":"img","attributes":{"src":"data:image/svg+xml,%3Csvg xmlns='http://www.w3.org/2000/svg' width='120' height='60'%3E%3Crect width='120' height='60' fill='%2387ceeb'/%3E%3C/svg%3E"},"html":"<img src=\"data:image/svg+xml,%3Csvg xmlns='http://www.w3.org/2000/svg' width='120' height='60'%3E%3Crect width='120' height='60' fill='%2387ceeb'/%3E%3C/svg%3E\" width=\"120\" height=\"60\">"},"children":[],"image":"data:image/png;base64,iVBORw0KGgoAAAANSUhEUgAAAHgAAAA9CAIAAADpkzpaAAAAnUlEQVR4nOzQQRGAMBAAsQ5T8bjDCB6uKrqvREL2zCzu2+/3L+57FgnREdER0RHREdER0RHREdER0RHREdER0RHREdER0RHREdER0RHREdER0RHREdER0RHREdER0RHREdER0RHREdER0RHREdER0RHREdER0RHREdER0RHREdER0RHREdER0RHREdER0RHREdER0RHREdER0RHRkQMAAP//cT7IyAAAAAZJREFUAwD66AW/3uFG7QAAAABJRU5ErkJggg=="}]}]}]},"collectedAt":"2026-10-08T02:12:52.080Z","collector":{"name":"rampa-web","version":"0.0.0"}}
